{
  "schema_version": 1,
  "generated_at": "2026-07-12T09:47:01.035Z",
  "baseline_digest": "sha256:21004327cdc573c565d06f90d700515d3e240c631aaad93192fbaaee8392994f",
  "handoff_digest": "sha256:b6450948874ec589e19b45d850619d3fb2aab8e4dceba0db195acef5976ed75f",
  "handoff_commit": "23e7cb975a17b9e9115bd75c26801dead2484209",
  "artifact_digests": {
    "docs/superpowers/evidence/phase-0/phase-0-context-pack.json": "sha256:19af668c3eca4af0ba2758b9b88ab3e03f1d072874df8ff8040dfa474301849b",
    "docs/superpowers/evidence/phase-0/phase-0-exit-baseline.json": "sha256:21004327cdc573c565d06f90d700515d3e240c631aaad93192fbaaee8392994f",
    "docs/superpowers/evidence/phase-0/phase-0-exit-report.md": "sha256:1013b05285d7467ce3e7c7038f70f1e377e259ba69570dbd9507c0fff1adbec7",
    "docs/superpowers/evidence/phase-0/phase-0-handoff.json": "sha256:b6450948874ec589e19b45d850619d3fb2aab8e4dceba0db195acef5976ed75f",
    "docs/superpowers/registry/oracle-lab-requirements.json": "sha256:4624fd7c71f509a03e06c5055f5de53bcc2579bb03ea594a318a661dbbbc37a5",
    "docs/superpowers/roadmaps/2026-07-11-claude-code-2.1.207-oracle-lab-roadmap.md": "sha256:fcc18a56785182e84de1004be23e05d9cd20d76c3b1d0348b7ae47ccf4c7d9e7"
  },
  "repository_heads": {
    "cc_gateway": "a94462b372b9397d914868450e12f2cc1f6dc002",
    "sub2api": "d596bb461b1cbb4f0ca8b299333f621ed8d4fd4f"
  },
  "retention_class": "phase_evidence_permanent",
  "redaction_policy": "digests_and_safe_redacted_excerpts_only",
  "destruction_procedure": "git_revert_artifact_commit_after_security_approval"
}
